{
  "version": "predict-opportunity-summaries-1",
  "server_id": "authored-summary-server",
  "epoch": "authored-epoch-1",
  "scope": "authored-selected-scope",
  "observed_at": "2026-10-16T14:01:00+00:00",
  "filters": {
    "venues": [],
    "sports": [],
    "leagues": [],
    "markets": [],
    "periods": [],
    "category": "covered_outcome_arb",
    "minimum_edge": "2",
    "minimum_size": "70"
  },
  "state": "available",
  "observation_window": {
    "from": "2026-10-16T14:00:00+00:00",
    "to": "2026-10-16T14:01:00+00:00"
  },
  "counts": {
    "observed_episodes": 0,
    "observed_new": 0,
    "left_censored": 0,
    "ended": 0,
    "open": 0,
    "gap_censored": 0
  },
  "edge_percent": {
    "minimum": null,
    "maximum": null
  },
  "supported_capital_usd": {
    "minimum": null,
    "maximum": null
  },
  "duration_seconds": {
    "minimum_observed": null,
    "maximum_observed": null,
    "complete_episodes": 0
  },
  "coverage": {
    "state": "evaluated_positive",
    "complete": true,
    "observed_complete_publications": 5,
    "gaps": 1,
    "checked_zero": true,
    "evaluated_pairs": 3,
    "compatible_pairs": 3
  },
  "history": {
    "complete": false,
    "evicted_episodes": 0,
    "continuity_lost": true,
    "threshold_history_complete": false
  },
  "bounds": {
    "retention_seconds": 604800,
    "episode_limit": 10000,
    "storage_limit_bytes": 10485760,
    "physical_bytes": 10485760,
    "physical_high_water_bytes": 10485760,
    "queue_observations": 0,
    "response_bytes": 65536
  },
  "notes": [
    "joint_threshold_history_incomplete"
  ],
  "unsupported_filters": [],
  "provider_requests": 0,
  "financial_evaluations": 0
}
